{
  "id": "C-M2-03-001",
  "theme": "M2-03",
  "origin": {
    "type": "variant",
    "parent_id": "M2-250611",
    "variation": "수치 변형",
    "note": "수치 변형"
  },
  "target": {
    "concept_ids": [
      "수학Ⅱ-08-C5",
      "수학Ⅱ-08-C2"
    ],
    "strategy_ids": [
      "S16"
    ],
    "first_judgment": "극한식은 $f(a)=3$, $f'(a)=-2$, 곧 접선 $y=-2(x-a)+3$을 준 것이므로 접선을 먼저 확정하고, 곡선과 접선의 차를 $(x-a)^2$ 꼴로 묶는다."
  },
  "difficulty": "기본 적용",
  "behavior": "계산",
  "question": "$f(x)=x^3+px^2+qx$ ($p$, $q$는 상수)에 대하여 $\\displaystyle\\lim_{x\\to a}\\frac{f(x)-3}{x-a}=-2$이다. 곡선 $y=f(x)$ 위의 점 $(a,\\,f(a))$에서의 접선의 $y$절편이 $9$일 때, $f(1)$의 값을 구하시오. (단, $a$는 상수이다.)",
  "condition": null,
  "choices": null,
  "answer": "7",
  "answer_value": "7",
  "figure": null,
  "solution": {
    "concept_refs": [
      "수학Ⅱ-08-C5",
      "수학Ⅱ-08-C2"
    ],
    "guide": "분모가 $0$으로 가는 극한이 존재하므로 분자도 $0$으로 간다. 그러면 $f(a)=3$이고 극한값이 곧 $f'(a)=-2$이다(수학Ⅱ-08-C5). 접점이 $(a,3)$이고 기울기가 $-2$인 접선은 $y=-2(x-a)+3$이다.",
    "solutions": [
      {
        "title": "풀이 1 · 스킬",
        "steps": [
          {
            "label": "접선 확정",
            "body": "접선 $y=-2(x-a)+3$의 $y$절편은 $3+2a=9$이므로 $a=3$이다. 접선은 $y=-2x+9$."
          },
          {
            "label": "인수 세우기",
            "body": "$f(x)-(-2x+9)$는 $x=3$에서 접하므로 $(x-3)^2$을 인수로 갖고, 최고차항이 $x^3$이므로 $f(x)=(x-3)^2(x+r)-2x+9$."
          },
          {
            "label": "상수항 비교",
            "body": "$f(0)=0$에서 $9r+9=0$, $r=-1$. 따라서 $f(1)=(1-3)^2\\cdot 0-2+9=7$."
          }
        ]
      },
      {
        "title": "풀이 2 · 정석 (비교)",
        "steps": [
          {
            "label": "조건 번역",
            "body": "$f(a)=3$, $f'(a)=-2$이고, 접선 $y=-2(x-a)+3$의 $y$절편이 $3+2a=9$이므로 $a=3$이다."
          },
          {
            "label": "연립 1",
            "body": "$f(3)=27+9p+3q=3$에서 $3p+q=-8$."
          },
          {
            "label": "연립 2",
            "body": "$f'(x)=3x^2+2px+q$이므로 $f'(3)=27+6p+q=-2$에서 $6p+q=-29$."
          },
          {
            "label": "풀이",
            "body": "두 식을 빼면 $3p=-21$, $p=-7$, $q=13$. 따라서 $f(x)=x^3-7x^2+13x$."
          },
          {
            "label": "답",
            "body": "$f(1)=1-7+13=7$."
          },
          {
            "label": "검산",
            "body": "앞 단계의 각 계산을 다시 한 줄씩 옮겨 적어 부호와 분모를 하나씩 대조한다. 중간 결과를 지우지 않고 아래로 이어 써야 다음 단계의 값을 놓치지 않는다."
          }
        ]
      }
    ],
    "supplement": "미정계수 $p,q$를 연립해서 풀어도 되지만, 접선이 정해지면 '곡선$-$접선'이 $(x-a)^2$을 인수로 가진다는 사실로 식을 세우는 편이 짧다. 이때 접선의 $y$절편을 $y=-2x+b$로 읽지 않고 접점에서 $y=f'(a)(x-a)+f(a)$로 쓰면 $a$가 먼저 구해진다.",
    "skill_point": "극한식 = 접선 한 줄. 접선을 확정한 뒤 $f(x)=(x-a)^2(\\cdots)+(\\text{접선})$으로 세운다."
  },
  "verify": "def skill():\n    a = Symbol('a')\n    a = solve(3 + 2*a - 9, a)[0]\n    x, r = Symbol('x'), Symbol('r')\n    f = (x - a)**2*(x + r) - 2*x + 9\n    rr = solve(f.subs(x, 0), r)[0]\n    return f.subs(r, rr).subs(x, 1)\n\ndef standard():\n    x, a, p, q = symbols('x a p q')\n    f = x**3 + p*x**2 + q*x\n    sol = solve([f.subs(x, a) - 3, diff(f, x).subs(x, a) + 2, 3 + 2*a - 9], [a, p, q], dict=True)\n    assert len(sol) == 1\n    return f.subs(sol[0]).subs(x, 1)\n\ndef unique():\n    return [standard()]\n",
  "status": "verified",
  "review": {
    "checked_at": "2026-09-30T07:25:53",
    "hash": "2eccdc76e62d02f3",
    "errors": [],
    "warnings": []
  }
}
