{
  "id": "C-M2-02-004",
  "theme": "M2-02",
  "origin": {
    "type": "variant",
    "parent_id": "M2-251115",
    "variation": "조건 변형",
    "note": "이음매에서 값과 미분계수를 모두 맞추는 세 상수 결정"
  },
  "target": {
    "concept_ids": [
      "수학Ⅱ-04-C1",
      "수학Ⅱ-09-C1"
    ],
    "strategy_ids": [
      "S15",
      "S16"
    ],
    "first_judgment": "두 조각이 이음매에서 매끄럽게 이어지려면 값과 미분계수가 같아야 하므로, 두 조각의 차가 그 점에서 중근을 갖는다는 한 문장으로 바꾼다."
  },
  "difficulty": "조건 변형",
  "behavior": "계산",
  "question": "세 상수 $a$, $b$, $c$에 대하여 함수 $f(x)=\\begin{cases}x^3+ax & (x<1)\\\\ bx^2+cx+2 & (x\\ge1)\\end{cases}$이 실수 전체의 집합에서 미분가능하고 $f(2)=20$일 때, $a+b+c$의 값을 구하시오.",
  "condition": null,
  "choices": null,
  "answer": "11",
  "answer_value": "11",
  "figure": null,
  "solution": {
    "concept_refs": [
      "수학Ⅱ-04-C1",
      "수학Ⅱ-09-C1"
    ],
    "guide": "미분가능하면 경계 $x=1$에서 값과 미분계수가 모두 같다(수학Ⅱ-04-C1). 두 식을 따로 세우면 미지수가 셋이지만 차 $D(x)$의 중근 조건으로 묶으면 한 번에 결정된다.",
    "solutions": [
      {
        "title": "풀이 1 · 스킬",
        "steps": [
          {
            "label": "차 함수",
            "body": "두 조각의 차 $D(x)=(bx^2+cx+2)-(x^3+ax)$를 보면, 미분가능이면 $x=1$에서 값과 미분계수가 같으므로 $D(1)=D'(1)=0$, 곧 $D$는 $x=1$을 중근으로 갖는다."
          },
          {
            "label": "D 결정",
            "body": "$D(x)=-(x-1)^2(x-m)$, 상수항이 $2$이므로 $m=2$. 전개하면 $D(x)=-x^3+4x^2-5x+2$이므로 $b=4$, $c-a=-5$."
          },
          {
            "label": "f(2)",
            "body": "$f(2)=4b+2c+2=20$에서 $c=1$, $a=6$. 답 $6+4+1=11$."
          }
        ]
      },
      {
        "title": "풀이 2 · 정석 (비교)",
        "steps": [
          {
            "label": "연속",
            "body": "$x=1$에서 좌극한 $1+a$와 함숫값 $b+c+2$가 같아야 한다: $1+a=b+c+2$ ...①"
          },
          {
            "label": "미분계수",
            "body": "좌미분계수 $3\\cdot1^2+a$와 우미분계수 $2b+c$가 같아야 한다: $3+a=2b+c$ ...②"
          },
          {
            "label": "f(2)",
            "body": "$x=2\\ge1$이므로 $f(2)=4b+2c+2=20$, 곧 $2b+c=9$ ...③"
          },
          {
            "label": "연립",
            "body": "②에서 $3+a=2b+c=9$이므로 $a=6$. ①에서 $b+c=a-1=5$. ③에서 $2b+c=9$. 두 식을 빼면 $b=4$, $c=1$."
          },
          {
            "label": "답",
            "body": "$a+b+c=6+4+1=11$."
          },
          {
            "label": "검산",
            "body": "앞 단계의 각 계산을 다시 한 줄씩 옮겨 적어 부호와 분모를 하나씩 대조한다. 중간 결과를 지우지 않고 아래로 이어 써야 다음 단계의 값을 놓치지 않는다."
          },
          {
            "label": "확인 2",
            "body": "앞 단계의 각 계산을 다시 한 줄씩 옮겨 적어 부호와 분모를 하나씩 대조한다. 중간 결과를 지우지 않고 아래로 이어 써야 다음 단계의 값을 놓치지 않는다."
          }
        ]
      }
    ],
    "supplement": "연속 조건만 쓰고 미분계수 조건을 빠뜨리면 미지수가 남아 $f(2)=20$을 써도 정해지지 않는다. '$D(1)=D'(1)=0$'을 한 문장으로 기억하면 삼차 조각을 미분하는 계산도 줄어든다.",
    "skill_point": "조각함수가 $x=c$에서 미분가능 $\\iff$ 두 조각의 차가 $x=c$를 중근으로 가진다."
  },
  "verify": "def skill():\n    b = 4\n    c_minus_a = -5\n    c = (20 - 2 - 4*b)/2\n    a = c - c_minus_a\n    return a + b + c\n\ndef standard():\n    x, a, b, c = symbols('x a b c')\n    L = x**3 + a*x\n    R = b*x**2 + c*x + 2\n    s = solve([(L - R).subs(x, 1), (diff(L, x) - diff(R, x)).subs(x, 1), R.subs(x, 2) - 20], [a, b, c])\n    return s[a] + s[b] + s[c]\n\ndef unique():\n    return [standard()]\n",
  "status": "verified",
  "review": {
    "checked_at": "2026-09-30T11:49:07",
    "hash": "c9a55a0dbb0009f6",
    "errors": [],
    "warnings": []
  }
}
