{
  "id": "C-PS-05-001",
  "theme": "PS-05",
  "origin": {
    "type": "variant",
    "parent_id": "PS-240929",
    "variation": "수치 변형",
    "note": "수치 변형"
  },
  "target": {
    "concept_ids": [
      "확률과 통계-14-C1",
      "확률과 통계-14-C2"
    ],
    "strategy_ids": [],
    "first_judgment": "카드가 처음 면으로 돌아오려면 뒤집힌 횟수가 짝수여야 하고, 한 번에 뒤집힐 확률은 $\\frac13$이다."
  },
  "difficulty": "기본 적용",
  "behavior": "계산",
  "question": "앞면에는 문자 $\\mathrm{A}$, 뒷면에는 문자 $\\mathrm{B}$가 적힌 한 장의 카드와 한 개의 주사위를 사용하여 다음 시행을 한다. 주사위를 한 번 던져 나온 눈의 수가 $5$ 이상이면 카드를 한 번 뒤집어 제자리에 놓고, $4$ 이하이면 카드를 그대로 둔다. 처음에 문자 $\\mathrm{A}$가 보이도록 카드가 놓여 있을 때, 이 시행을 $4$번 반복한 후 문자 $\\mathrm{A}$가 보이도록 카드가 놓일 확률은 $\\dfrac qp$이다. $p+q$의 값을 구하시오. (단, $p$와 $q$는 서로소인 자연수이다.)",
  "condition": null,
  "choices": null,
  "answer": "122",
  "answer_value": "122",
  "figure": null,
  "solution": {
    "concept_refs": [
      "확률과 통계-14-C1",
      "확률과 통계-14-C2"
    ],
    "guide": "'다시 $\\mathrm A$가 보인다'를 '뒤집힌 횟수가 짝수'로 번역한다. 한 번의 시행에서 뒤집힐 확률(성공)은 눈이 $5,6$인 $\\frac26=\\frac13$이다(확률과 통계-14-C1).",
    "solutions": [
      {
        "title": "풀이 1 · 스킬",
        "steps": [
          {
            "label": "번역",
            "body": "$\\mathrm A$가 보인다 ⇔ 뒤집힌 횟수가 짝수. 성공(뒤집힘) 확률 $p=\\frac13$, 실패 확률 $q=\\frac23$이므로 $q-p=\\frac13$."
          },
          {
            "label": "공식",
            "body": "짝수 번 성공할 확률은 $\\dfrac{1+(q-p)^n}{2}=\\dfrac{1+\\left(\\frac13\\right)^4}{2}=\\dfrac{1}{2}\\cdot\\dfrac{82}{81}=\\dfrac{41}{81}$."
          },
          {
            "label": "답",
            "body": "$p=81$, $q=41$이므로 $p+q=122$."
          }
        ]
      },
      {
        "title": "풀이 2 · 정석 (비교)",
        "steps": [
          {
            "label": "경우 나누기",
            "body": "뒤집힌 횟수 $r$가 $0,2,4$인 경우를 모두 더한다. 성공 확률 $\\frac13$, 실패 확률 $\\frac23$이다."
          },
          {
            "label": "각 항",
            "body": "$r=0$: $\\left(\\frac23\\right)^4=\\frac{16}{81}$. $r=2$: ${}_4C_2\\left(\\frac13\\right)^2\\left(\\frac23\\right)^2=6\\cdot\\frac{4}{81}=\\frac{24}{81}$. $r=4$: $\\left(\\frac13\\right)^4=\\frac1{81}$."
          },
          {
            "label": "합",
            "body": "$\\frac{16}{81}+\\frac{24}{81}+\\frac{1}{81}=\\frac{41}{81}$이므로 $p+q=81+41=122$."
          },
          {
            "label": "참고",
            "body": "항이 셋이라 계산은 어렵지 않지만, 반복 횟수가 커지면 항이 늘어난다. 공식은 항을 세지 않고 $(q-p)^n$ 한 개로 짝수 항의 합을 준다."
          }
        ]
      }
    ],
    "supplement": "뒤집힌 횟수가 '홀수'인지 '짝수'인지를 헷갈리는 것이 가장 흔한 실수다. 처음 상태로 돌아오면 짝수, 바뀌면 홀수이다. $p=\\frac12$이면 $q-p=0$이므로 답이 항상 $\\frac12$이다.",
    "skill_point": "상태 유지 = 짝수 번: $\\dfrac{1+(q-p)^n}{2}$, 상태 변화 = 홀수 번: $\\dfrac{1-(q-p)^n}{2}$."
  },
  "verify": "def skill():\n    p, q = Rational(1, 3), Rational(2, 3)\n    v = (1 + (q - p)**4) / 2\n    return v.p + v.q\n\ndef standard():\n    from math import comb\n    v = sum(Fraction(comb(4, r) * 2**(4 - r), 3**4) for r in range(0, 5, 2))\n    return v.numerator + v.denominator\n\ndef unique():\n    return [standard()]\n",
  "status": "verified",
  "review": {
    "checked_at": "2026-09-30T07:24:14",
    "hash": "8a1e0926d5f62d97",
    "errors": [],
    "warnings": []
  }
}
