{
  "id": "C-M1-09-004",
  "theme": "M1-09",
  "origin": {
    "type": "variant",
    "parent_id": "M1-251112",
    "variation": "수치 변형",
    "note": "수치 변형"
  },
  "target": {
    "concept_ids": [
      "수학Ⅰ-16-C1"
    ],
    "strategy_ids": [
      "S10"
    ],
    "first_judgment": "$n=1$을 대입하면 $\\dfrac{a_1}{b_2}$의 값이 나와 $b_2$가 정해지므로 등차수열 $\\{b_n\\}$부터 확정하고, 그 뒤 $n$과 $n-1$의 차로 $a_n$을 꺼낸다."
  },
  "difficulty": "조건 변형",
  "behavior": "계산",
  "question": "첫째항이 $6$인 수열 $\\{a_n\\}$과 첫째항이 $1$인 등차수열 $\\{b_n\\}$이 있다. 모든 자연수 $n$에 대하여 $\\displaystyle\\sum_{k=1}^{n}\\frac{a_k}{b_{k+1}}=n^2+2n$이 성립할 때, $a_1+a_2+a_3+a_4+a_5$의 값을 구하시오.",
  "condition": null,
  "choices": null,
  "answer": "160",
  "answer_value": "160",
  "figure": null,
  "solution": {
    "concept_refs": [
      "수학Ⅰ-16-C1"
    ],
    "guide": "모르는 것이 두 수열이다. $n=1$에서 $\\dfrac{a_1}{b_2}=3$이고 $a_1=6$이므로 $b_2=2$, 공차 $1$로 $b_n=n$이 확정된다. 이후 $\\dfrac{a_n}{b_{n+1}}$을 $c_n$으로 보고 $c_n=F(n)-F(n-1)$을 쓴다(수학Ⅰ-16-C1).",
    "solutions": [
      {
        "title": "풀이 1 · 스킬",
        "steps": [
          {
            "label": "$\\{b_n\\}$ 확정",
            "body": "$n=1$: $\\dfrac{a_1}{b_2}=3$이므로 $b_2=2$. $b_1=1$이므로 공차 $1$, $b_n=n$."
          },
          {
            "label": "$a_n$",
            "body": "$n\\ge2$에서 $\\dfrac{a_n}{b_{n+1}}=(n^2+2n)-\\{(n-1)^2+2(n-1)\\}=2n+1$이므로 $a_n=(2n+1)(n+1)$. $n=1$일 때 $3\\cdot2=6$으로 $a_1$과 일치."
          },
          {
            "label": "합",
            "body": "$a_1,\\dots,a_5=6,\\ 15,\\ 28,\\ 45,\\ 66$이므로 합은 $160$."
          }
        ]
      },
      {
        "title": "풀이 2 · 정석 (비교)",
        "steps": [
          {
            "label": "$\\{b_n\\}$의 공차",
            "body": "공차를 $d$라 하면 $b_2=1+d$. $n=1$에서 $\\dfrac{6}{1+d}=3$이므로 $d=1$."
          },
          {
            "label": "$b_n$",
            "body": "$b_n=n$, 곧 $b_{k+1}=k+1$."
          },
          {
            "label": "두 식의 차",
            "body": "$\\sum_{k=1}^{n}\\dfrac{a_k}{k+1}=n^2+2n$과 $n-1$일 때의 식을 빼면 $\\dfrac{a_n}{n+1}=2n+1$ ($n\\ge2$)."
          },
          {
            "label": "$a_n$",
            "body": "$a_n=(2n+1)(n+1)=2n^2+3n+1$. $n=1$에서 $6$으로 주어진 값과 같다."
          },
          {
            "label": "합 공식",
            "body": "$\\sum_{k=1}^{5}(2k^2+3k+1)=2\\cdot55+3\\cdot15+5=160$."
          },
          {
            "label": "검산",
            "body": "앞 단계의 각 계산을 다시 한 줄씩 옮겨 적어 부호와 분모를 하나씩 대조한다. 중간 결과를 지우지 않고 아래로 이어 써야 다음 단계의 값을 놓치지 않는다."
          }
        ]
      }
    ],
    "supplement": "$a_1$을 미리 주었으므로 $n=1$ 하나만으로 $b_2$가 정해지고, $\\{b_n\\}$이 등차수열이라는 조건이 그 즉시 $b_n=n$을 준다. $b_n$을 모르는 채로 차를 구하려 하면 $a_n=(\\ldots)b_{n+1}$에서 막힌다.",
    "skill_point": "미지의 수열이 둘이면 $n=1$을 먼저 넣어 하나를 확정한다. 그 뒤에 $n$과 $n-1$의 차."
  },
  "verify": "def skill():\n    b = lambda n: n\n    a = {}\n    for n in range(1, 6):\n        F = lambda m: m**2 + 2*m\n        c = F(n) - (F(n - 1) if n >= 2 else 0)\n        a[n] = c*b(n + 1)\n    assert a[1] == 6\n    return sum(a.values())\n\ndef standard():\n    d = Symbol('d')\n    dd = solve(Eq(Rational(6)/(1 + d), 3), d)[0]\n    b = lambda n: 1 + (n - 1)*dd\n    a = [6]\n    for n in range(2, 6):\n        target = n**2 + 2*n\n        prev = sum(a[k - 1]/b(k + 1) for k in range(1, n))\n        a.append((target - prev)*b(n + 1))\n    return sum(a)\n\ndef unique():\n    return [standard()]\n",
  "status": "verified",
  "review": {
    "checked_at": "2026-09-30T07:32:23",
    "hash": "db840b845f6c6f71",
    "errors": [],
    "warnings": []
  }
}
