{
  "id": "C-PS-07-005",
  "theme": "PS-07",
  "origin": {
    "type": "variant",
    "parent_id": "PS-250929",
    "variation": "조건 변형",
    "note": "조건 변형"
  },
  "target": {
    "concept_ids": [
      "확률과 통계-20-C3",
      "확률과 통계-20-C2"
    ],
    "strategy_ids": [],
    "first_judgment": "눈이 $2$ 이하로 나온 횟수를 $X$로 두면 위치는 $3X-4050$이므로 조건을 $X\\ge1395$로 바꾸고, $X\\sim\\mathrm B\\left(4050,\\frac13\\right)$을 정규분포로 근사해 표준화한다."
  },
  "difficulty": "조건 변형",
  "behavior": "계산",
  "question": "수직선 위의 원점에 놓인 점 $\\mathrm{P}$를 주사위 한 개를 던져 나온 결과에 따라 움직인다. 주사위를 $4050$번 던진 뒤 점 $\\mathrm{P}$의 좌표가 $135$ 이상일 확률을 표준정규분포표를 이용하여 구한 값을 $k$라 할 때, $1000k$의 값을 구하시오.",
  "condition": "[규칙] 한 번 던져 눈의 수가 $1$ 또는 $2$이면 점 $\\mathrm{P}$의 좌표에 $2$를 더하고, 그 밖의 눈이 나오면 점 $\\mathrm{P}$의 좌표에서 $1$을 뺀다.\\\\표준정규분포표: $z$: $\\mathrm P(0\\le Z\\le z)$ — $1.0$: $0.341$, $1.5$: $0.433$, $2.0$: $0.477$, $2.5$: $0.494$",
  "choices": null,
  "answer": "67",
  "answer_value": "67",
  "figure": null,
  "solution": {
    "concept_refs": [
      "확률과 통계-20-C3",
      "확률과 통계-20-C2"
    ],
    "guide": "위치를 성공 횟수 $X$의 일차식 $2X-(4050-X)=3X-4050$으로 쓴다(확률과 통계-20-C3). $X\\sim\\mathrm B\\left(4050,\\frac13\\right)$이고 $\\sigma^2=4050\\cdot\\frac13\\cdot\\frac23=900$으로 정수가 되어 설계 의도와 맞다(확률과 통계-20-C2).",
    "solutions": [
      {
        "title": "풀이 1 · 스킬",
        "steps": [
          {
            "label": "일차식",
            "body": "위치 $=3X-4050\\ge135$ ⇔ $X\\ge1395$."
          },
          {
            "label": "근사",
            "body": "$X\\sim\\mathrm B\\left(4050,\\frac13\\right)\\approx\\mathrm N(1350,30^2)$."
          },
          {
            "label": "표준화",
            "body": "$\\mathrm P(X\\ge1395)=\\mathrm P\\left(Z\\ge\\frac{1395-1350}{30}\\right)=\\mathrm P(Z\\ge1.5)=0.5-0.433=0.067$. $1000k=67$."
          }
        ]
      },
      {
        "title": "풀이 2 · 정석 (비교)",
        "steps": [
          {
            "label": "위치의 식",
            "body": "눈이 $2$ 이하인 횟수를 $X$라 하면 위치는 $2X-(4050-X)=3X-4050$. 부등식 $3X-4050\\ge135$를 풀면 $X\\ge1395$."
          },
          {
            "label": "평균·분산",
            "body": "$\\mathrm E(X)=4050\\cdot\\frac13=1350$, $\\mathrm V(X)=4050\\cdot\\frac13\\cdot\\frac23=900$, $\\sigma=30$."
          },
          {
            "label": "정규 근사",
            "body": "$X$는 근사적으로 $\\mathrm N(1350,30^2)$을 따르므로 $\\mathrm P(X\\ge1395)\\approx\\mathrm P\\left(Z\\ge\\frac{1395-1350}{30}\\right)$."
          },
          {
            "label": "표 사용",
            "body": "$\\mathrm P(Z\\ge1.5)=\\mathrm P(Z\\ge0)-\\mathrm P(0\\le Z\\le1.5)=0.5-0.433=0.067$."
          },
          {
            "label": "답",
            "body": "$k=0.067$이므로 $1000k=67$."
          }
        ]
      }
    ],
    "supplement": "위치를 따로 정규분포로 다루면 평균·표준편차를 다시 구해야 한다. 이미 분포를 아는 $X$로 옮겨 놓으면 표준화가 한 번으로 끝난다. 이동 방향이 반대($-$)인 경우 부등호의 방향이 뒤집히는 점에 유의한다.",
    "skill_point": "위치·점수는 성공 횟수 $X$의 일차식으로 바꾸어 $X$의 부등식으로 표준화한다."
  },
  "verify": "def skill():\n    tbl = {1.0: Rational('0.341'), 1.5: Rational('0.433'), 2.0: Rational('0.477'), 2.5: Rational('0.494')}\n    n, p = 4050, Rational(1, 3)\n    mean, sd = n*p, sqrt(n*p*(1 - p))\n    z = (1395 - mean) / sd\n    return 1000*(Rational(1, 2) - tbl[float(z)])\n\ndef standard():\n    tbl = {1.0: Rational('0.341'), 1.5: Rational('0.433'), 2.0: Rational('0.477'), 2.5: Rational('0.494')}\n    n = 4050\n    # 한 번 시행의 이동량 분포: 눈 1,2 → +2, 눈 3~6 → -1\n    steps = [2 if k <= 2 else -1 for k in range(1, 7)]\n    m1 = Rational(sum(steps), 6)\n    v1 = Rational(sum(s**2 for s in steps), 6) - m1**2\n    mean, sd = n*m1, sqrt(n*v1)\n    z = (135 - mean) / sd\n    return 1000*(Rational(1, 2) - tbl[float(z)])\n\ndef unique():\n    return [standard()]\n",
  "status": "verified",
  "review": {
    "checked_at": "2026-09-30T07:28:47",
    "hash": "402e6595d43d01ba",
    "errors": [],
    "warnings": []
  }
}
