{
  "id": "C-M1-09-201",
  "theme": "M1-09",
  "origin": {
    "type": "original",
    "note": "부분분수·시그마 계산 실수 교정용 신작"
  },
  "target": {
    "concept_ids": [
      "수학Ⅰ-16-C2"
    ],
    "strategy_ids": [],
    "first_judgment": "각 항을 부분분수로 나누면 이웃한 항이 소거되고 양 끝의 항만 남는다."
  },
  "difficulty": "조건 변형",
  "behavior": "계산",
  "question": "$\\displaystyle\\sum_{k=1}^{8}\\frac{1}{k(k+1)}$의 값을 $\\frac{q}{p}$라 할 때, $p+q$의 값을 구하시오. (단, $p$와 $q$는 서로소인 자연수이다.)",
  "condition": null,
  "choices": null,
  "answer": "17",
  "answer_value": "17",
  "figure": null,
  "solution": {
    "concept_refs": [
      "수학Ⅰ-16-C2"
    ],
    "guide": "각 항을 부분분수로 나누면 이웃한 항이 소거되고 양 끝의 항만 남는다.",
    "solutions": [
      {
        "title": "풀이 1 · 스킬",
        "steps": [
          {
            "label": "소거",
            "body": "$\\frac1{k(k+1)}=\\frac1k-\\frac1{k+1}$이므로 남는 것은 첫 항과 끝 항: $\\frac1{1}-\\frac1{9}$"
          },
          {
            "label": "계산",
            "body": "통분하면 $\\frac{8}{9}$ → $p+q=17$"
          }
        ]
      },
      {
        "title": "풀이 2 · 정석 (비교)",
        "steps": [
          {
            "label": "항 계산",
            "body": "$\\frac1{1\\cdot2}+\\frac1{2\\cdot3}+\\cdots$를 하나씩 통분하며 더한다."
          },
          {
            "label": "부분합",
            "body": "처음 세 부분합은 $\\frac{1}{2},\\ \\frac{2}{3},\\ \\frac{3}{4}$이고 이렇게 $8$개 항을 모두 더해야 한다."
          },
          {
            "label": "규칙 발견",
            "body": "부분합이 $\\frac1{1}-\\frac1{k+1}$ 꼴임을 알아채면 마지막 부분합은 $\\frac1{1}-\\frac1{9}=\\frac{8}{9}$"
          },
          {
            "label": "답",
            "body": "$p=9$, $q=8$ → $p+q=17$"
          }
        ]
      }
    ],
    "supplement": "항을 하나씩 더하면 분모가 계속 바뀐다. 소거되고 남는 양 끝만 적으면 통분은 마지막에 한 번뿐이다.",
    "skill_point": "부분분수로 쪼갠 뒤 '남는 첫 항과 끝 항'만 적고 나머지는 쓰지 않는다."
  },
  "verify": "def skill():\n    v = Fraction(1, 1) - Fraction(1, 9)\n    return v.numerator + v.denominator\n\ndef standard():\n    k = Symbol('k', integer=True)\n    v = summation(Rational(1)/(k*(k + 1)), (k, 1, 8))\n    return v.p + v.q\n\ndef unique():\n    return [standard()]\n",
  "calc_type": "부분분수와 연쇄 소거",
  "status": "verified",
  "review": {
    "checked_at": "2026-09-30T07:10:55",
    "hash": "eb37743b681ed309",
    "errors": [],
    "warnings": []
  }
}
