{
  "id": "C-M2-06-004",
  "theme": "M2-06",
  "origin": {
    "type": "variant",
    "parent_id": "M2-260909",
    "variation": "조건 변형",
    "note": "도함수가 상수(1)에서 일차식(2x)로 바뀌어 H가 이차함수가 됨"
  },
  "target": {
    "concept_ids": [
      "수학Ⅱ-14-C3"
    ],
    "strategy_ids": [
      "S23"
    ],
    "first_judgment": "$H(x)=G(x)-2F(x)$로 묶으면 $H'(x)=2x$가 되어 $f$를 모르는 채로 $H$가 정해진다."
  },
  "difficulty": "조건 변형",
  "behavior": "이해",
  "question": "다항함수 $f(x)$의 한 부정적분을 $F(x)$, 함수 $2f(x)+2x$의 한 부정적분을 $G(x)$라 하자. $G(2)=2F(2)+1$일 때, $G(5)-2F(5)$의 값을 구하시오.",
  "condition": null,
  "choices": null,
  "answer": "22",
  "answer_value": "22",
  "figure": null,
  "solution": {
    "concept_refs": [
      "수학Ⅱ-14-C3"
    ],
    "guide": "$f$는 주어지지 않았으므로 $F$와 $G$를 따로 구할 수 없다. 두 함수가 함께 들어 있는 $G-2F$의 도함수를 먼저 본다(수학Ⅱ-14-C3).",
    "solutions": [
      {
        "title": "풀이 1 · 스킬",
        "steps": [
          {
            "label": "묶기",
            "body": "$H(x)=G(x)-2F(x)$라 하면 $H'(x)=\\{2f(x)+2x\\}-2f(x)=2x$."
          },
          {
            "label": "상수",
            "body": "$H(x)=x^2+C$. 조건 $G(2)-2F(2)=1$은 $H(2)=1$이므로 $4+C=1$, $C=-3$."
          },
          {
            "label": "값",
            "body": "$G(5)-2F(5)=H(5)=25-3=22$."
          }
        ]
      },
      {
        "title": "풀이 2 · 정석 (비교)",
        "steps": [
          {
            "label": "문자 도입",
            "body": "$f(x)$를 미정계수 다항식으로 두면 차수를 알 수 없어 $F$, $G$를 쓸 수 없다. 그래서 $F$와 $G$의 도함수를 직접 비교한다."
          },
          {
            "label": "차의 도함수",
            "body": "$G'(x)=2f(x)+2x=2F'(x)+2x$이므로 $\\{G(x)-2F(x)\\}'=2x$."
          },
          {
            "label": "적분",
            "body": "양변을 $x$에 대해 적분하면 $G(x)-2F(x)=x^2+C$ ($C$는 적분상수)."
          },
          {
            "label": "상수 결정",
            "body": "$x=2$를 대입하면 $G(2)-2F(2)=4+C=1$이므로 $C=-3$."
          },
          {
            "label": "값",
            "body": "$x=5$를 대입하면 $G(5)-2F(5)=25-3=22$."
          }
        ]
      }
    ],
    "supplement": "$f$를 구하려고 하면 조건이 모자라 막힌다. 구하는 값이 $G-2F$ 꼴 하나로 되어 있으니 그 조합이 바로 풀 대상이다. 부정적분마다 적분상수가 따로 있어도 조합의 상수 하나만 정하면 된다.",
    "skill_point": "부정적분 여러 개의 조합이 나오면 그 조합을 하나의 함수 $H$로 두고 $H'$부터 본다."
  },
  "verify": "def skill():\n    x, C = symbols('x C')\n    H = x**2 + C\n    C0 = solve(H.subs(x, 2) - 1, C)[0]\n    return H.subs(C, C0).subs(x, 5)\n\ndef standard():\n    # f를 임의의 다항식(차수 4)으로 두고 F, G를 만들어 조건을 만족하는 모든 경우를 검사\n    x = Symbol('x')\n    cs = symbols('c0:5')\n    k1, k2 = symbols('k1 k2')\n    f = sum(c*x**i for i, c in enumerate(cs))\n    F = integrate(f, x) + k1\n    G = integrate(2*f + 2*x, x) + k2\n    s = solve(G.subs(x, 2) - 2*F.subs(x, 2) - 1, k2)[0]\n    G = G.subs(k2, s)\n    return simplify(G.subs(x, 5) - 2*F.subs(x, 5))\n\ndef unique():\n    return [standard()]\n",
  "status": "verified",
  "review": {
    "checked_at": "2026-09-30T07:27:15",
    "hash": "f9b6b7976f6e35ae",
    "errors": [],
    "warnings": []
  }
}
