{
  "id": "C-M1-09-126",
  "theme": "M1-09",
  "origin": {
    "type": "original",
    "note": "분수 계산 실수 교정용 신작"
  },
  "target": {
    "concept_ids": [
      "수학Ⅰ-16-C3"
    ],
    "strategy_ids": [],
    "first_judgment": "분수를 하나씩 이어 계산하지 않고, 공통 분모나 공통 인수를 먼저 정해 한 번에 정리한다."
  },
  "difficulty": "조건 변형",
  "behavior": "계산",
  "question": "$\\dfrac{\\frac{4}{5}-\\frac{1}{4}}{\\frac{1}{2}}$의 값을 $\\frac{q}{p}$라 할 때, $p+q$의 값을 구하시오. (단, $p$와 $q$는 서로소인 자연수이다.)",
  "condition": null,
  "choices": null,
  "answer": "21",
  "answer_value": "21",
  "figure": null,
  "solution": {
    "concept_refs": [
      "수학Ⅰ-16-C3"
    ],
    "guide": "분수를 하나씩 이어 계산하지 않고, 공통 분모나 공통 인수를 먼저 정해 한 번에 정리한다.",
    "solutions": [
      {
        "title": "풀이 1 · 스킬",
        "steps": [
          {
            "label": "분자",
            "body": "분자 $\\frac{4}{5}-\\frac{1}{4}=\\frac{11}{20}$"
          },
          {
            "label": "역수",
            "body": "분모가 분수이면 역수를 곱한다: $\\frac{11}{20}\\times\\frac{2}{1}=\\frac{11}{10}$ → $p+q=21$"
          }
        ]
      },
      {
        "title": "풀이 2 · 정석 (비교)",
        "steps": [
          {
            "label": "분자 통분",
            "body": "분자 $\\frac{4}{5}-\\frac{1}{4}$의 분모를 $20$로 맞춘다: $\\frac{16}{20}-\\frac{5}{20}=\\frac{11}{20}$"
          },
          {
            "label": "분모",
            "body": "분모는 $\\frac{1}{2}$ 그대로이다."
          },
          {
            "label": "나눗셈",
            "body": "분수의 나눗셈은 $\\frac{11}{20}\\div\\frac{1}{2}=\\frac{11}{20}\\times\\frac{2}{1}$이고, 약분하여 $\\frac{11}{10}$"
          },
          {
            "label": "답",
            "body": "$p=10$, $q=11$ → $p+q=21$"
          }
        ]
      }
    ],
    "supplement": "두 항씩 통분하면 분모가 두 번 바뀌고 약분도 두 번 해야 한다. 공통 분모를 한 번에 잡으면 분자의 정수 계산만 남는다.",
    "skill_point": "분모의 최소공배수(또는 공통 인수)를 먼저 정하고, 상수는 마지막에 한 번만 계산한다."
  },
  "verify": "def skill():\n    v = (Fraction(4, 5) - Fraction(1, 4)) * Fraction(2, 1)\n    return v.numerator + v.denominator\n\ndef standard():\n    v = (Rational(4, 5) - Rational(1, 4)) / Rational(1, 2)\n    return v.p + v.q\n\ndef unique():\n    return [standard()]\n",
  "calc_type": "분수 계산 전처리",
  "status": "verified",
  "review": {
    "checked_at": "2026-09-30T07:09:27",
    "hash": "9700037d04c18336",
    "errors": [],
    "warnings": []
  }
}
